{
  "schema_version": 1,
  "id": "anthropics/skills/frontend-design",
  "name": "frontend-design",
  "description": "Guides deliberate visual direction, typography, layout, responsive behavior, and interface self-critique.",
  "category": "design",
  "source": {
    "repository": "https://github.com/anthropics/skills",
    "commit": "f6656c1256d5a8adfa37db9110046ef20bac644c",
    "path": "skills/frontend-design",
    "maturity": "official-example"
  },
  "license": { "spdx": "Apache-2.0", "file": "skills/frontend-design/LICENSE.txt" },
  "risk": {
    "network": "optional",
    "commands": true,
    "writes": "workspace",
    "reviewed_at": "2026-08-14"
  }
}

