{
  "schema_version": 1,
  "id": "obra/superpowers/verification-before-completion",
  "name": "verification-before-completion",
  "description": "Requires fresh command output and direct evidence before claiming that work is complete, fixed, or passing.",
  "category": "development",
  "source": {
    "repository": "https://github.com/obra/superpowers",
    "commit": "b36e0829c6d0140e93cfef2ca599b1b07d4a7797",
    "path": "skills/verification-before-completion",
    "maturity": "established"
  },
  "license": { "spdx": "MIT", "file": "LICENSE" },
  "risk": {
    "network": "optional",
    "commands": true,
    "writes": "none",
    "reviewed_at": "2026-08-14"
  }
}

