{
  "schema_version": 1,
  "id": "obra/superpowers/systematic-debugging",
  "name": "systematic-debugging",
  "description": "Uses reproducible evidence, data-flow tracing, and single-hypothesis tests before proposing a bug fix.",
  "category": "development",
  "source": {
    "repository": "https://github.com/obra/superpowers",
    "commit": "b36e0829c6d0140e93cfef2ca599b1b07d4a7797",
    "path": "skills/systematic-debugging",
    "maturity": "established"
  },
  "license": { "spdx": "MIT", "file": "LICENSE" },
  "risk": {
    "network": "optional",
    "commands": true,
    "writes": "workspace",
    "reviewed_at": "2026-08-14"
  },
  "notes": "The upstream bundle keeps several referenced files at its root; the static report exposes those structure warnings."
}

